author,title,description,url,urlToImage,publishedAt,content,source.id,source.name
https://www.facebook.com/entertainmentweekly,Steve Martin is 'so proud' of his novella Shopgirl being banned from school libraries in Florida [Entertainment Weekly],Steve Martin jokingly celebrated his book 'Shopgirl' being banned in a Florida school district: 'Now people who want to read it will have to buy a copy!',https://ew.com/books/steve-martin-proud-shopgirl-banned-in-florida-schools/,https://ew.com/thmb/FCvQDfekltjOXHs-4dmgYY52Wfs=/1500x0/filters:no_upscale():max_bytes(150000):strip_icc()/GettyImages-464173246-8fdd10d68bfb443f9bd60478b438d728.jpg,2023-11-10T08:00:00Z,"Some authors celebrate when their books become bestsellers, but Steve Martin is ""proud"" to see his novel on a different list.
In a cheerful social media post, the Only Murders in the Building star m… [+1889 chars]",entertainment-weekly,Entertainment Weekly
Dalton Ross,'Big Brother' to air 'Reindeer Games' all-stars mini-season,"'Big Brother' to air 'Reindeer Games' all-stars mini-season featuring no host, no live feeds, and no houseguests.",https://ew.com/tv/big-brother-reindeer-games-all-stars-legends-season/,https://ew.com/thmb/wsBhmn35cjhenN6B7ycWATHPIVE=/1500x0/filters:no_upscale():max_bytes(150000):strip_icc()/Tiffany-Mitchell-Derek-Xiao-Jordan-Lloyd-110923-1-bc5f343e1d2543ba9879826cb5554636.jpg,2023-11-10T03:00:00Z,"Just last week, we asked Big Brother host Julie Chen Moonves if there could be a winter installment of the franchise due to the actors strike that had ground production on scripted content to a halt.… [+2873 chars]",entertainment-weekly,Entertainment Weekly
Kristen Baldwin,'The Golden Bachelor' recap: The sweetest 'Women Tell All' ever,"With no yelling, name-calling, or spotlight hogging, 'The Golden Bachelor' gave viewers the sweetest 'Women Tell All' reunion ever. Read our recap.",https://ew.com/tv/recaps/the-golden-bachelor-season-1-episode-7/,https://ew.com/thmb/yTb2HtArlgAqhQZM5A8X1yCt6AM=/1500x0/filters:no_upscale():max_bytes(150000):strip_icc()/The-Golden-Bachelor-recap-110723-b56e026a17da4a08b106de270e027052.jpg,2023-11-10T02:00:00Z,"For the first time in the history of the Bachelor franchise, contestants made it through an entire Women Tell All special without name-calling, shouting, annoying crosstalk, or blatant, attention-see… [+16838 chars]",entertainment-weekly,Entertainment Weekly
Wesley Stenzel,Barbra Streisand thinks she 'probably' slept with Warren Beatty,"In her new memoir, Barbra Streisand writes that she 'probably' slept with her longtime friend Warren Beatty: 'I kind of remember. I guess I did.'",https://ew.com/celebrity/barbra-streisand-says-she-probably-slept-with-warren-beatty/,https://ew.com/thmb/HX0WaHcrhG7XN3fjPVYNBRDlJEM=/1500x0/filters:no_upscale():max_bytes(150000):strip_icc()/Barbra-Streisand-Warren-Beatty-110923-6065cdf139c1473fb7e642ebd1a2fca7.jpg,2023-11-09T22:46:19Z,"Here's a case only Dick Tracy could solve: What happened between Barbra Streisand and Warren Beatty?
Even Streisand isn't sure. In her new memoir, My Name is Barbra, the multihyphenate entertainer r… [+2826 chars]",entertainment-weekly,Entertainment Weekly
Nick Romano,"'Avatar: The Last Airbender' live-action trailer reveals Appa, premiere date",Netflix's first 'Avatar: The Last Airbender' trailer sets a premiere date and reveals more live-action versions of familiar characters.,https://ew.com/tv/avatar-the-last-airbender-live-action-trailer-premiere-date/,https://ew.com/thmb/mjUHu1NOF5lFIlbpArHoqNSHZVw=/1500x0/filters:no_upscale():max_bytes(150000):strip_icc()/Avatar-the-Last-Airbender-Netflix-110923-tout-ac78071d702c4025b1a57a51fb9aff54.jpg,2023-11-09T22:14:09Z,"The Water, Earth, Fire, and Air Nations will officially converge early next year.
At long last, Netflix has revealed the first trailer for its live-action adaptation of Avatar: The Last Airbender, d… [+2791 chars]",entertainment-weekly,Entertainment Weekly
Nick Romano,'Camp Cretaceous' team sets 'Jurassic World: Chaos Theory' for 2024,"After 'Jurassic World: Camp Cretaceous,' Netflix has revealed new series 'Jurassic World: Chaos Theory' is coming in 2024. Watch for the surprise at the end of the announcement teaser.",https://ew.com/tv/jurassic-world-chaos-theory-sequel-series-camp-cretaceous-2024/,https://ew.com/thmb/LaJripTfO2uUKbSte7v5WaufQ1w=/1500x0/filters:no_upscale():max_bytes(150000):strip_icc()/Jurassic-World-Chaos-Theory-110823-2-3959524522034f0cb077c586972481c5.jpg,2023-11-09T21:43:34Z,"More than a year after Jurassic World: Camp Cretaceousclosed its park gates... they are reopening.
Netflix announced a new CG-animated series Jurassic World: Chaos Theory out of Geeked Week, the vir… [+2908 chars]",entertainment-weekly,Entertainment Weekly
Jessica Wang,Jared Leto now first person to climb to top of Empire State Building,"Jared Leto has become the first person to legally climb to the top of the Empire State Building, its officials say: 'It was a lot harder than I thought it would be.'",https://ew.com/celebrity/jared-leto-climbs-empire-state-building-thirty-seconds-to-mars-tour/,https://ew.com/thmb/lhAHuK00POCarG1mZvW8nfWb6cc=/1500x0/filters:no_upscale():max_bytes(150000):strip_icc()/Jared-Leto-Climbing-Empire-State-Building-110923-5-7813e863facf4737b406b8dde75fc75c.jpg,2023-11-09T18:09:28Z,"Jared Leto is taking his stardom to new heights literally.
The 51-year-old actor and Thirty Seconds to Mars frontman climbed the Empire State Building on Thursday to promote his band's upcoming worl… [+2041 chars]",entertainment-weekly,Entertainment Weekly
Emlyn Travis,'Inside Out 2' teaser trailer: Anxiety is Riley's newest emotion,A brand-new emotion has arrived at Headquarters in the teaser trailer for Pixar's 'Inside Out 2' — and she's voiced by Maya Hawke!,https://ew.com/movies/inside-out-2-trailer-new-emotion-anxiety-maya-hawke/,https://ew.com/thmb/0LXt1fx9YrTI3K75g6XDItuKsoI=/1500x0/filters:no_upscale():max_bytes(150000):strip_icc()/Inside-Out-2-110923-625f9380d3934014b50a312c89c55bed.jpg,2023-11-09T15:58:21Z,"An awkward new emotion has officially arrived in the new teaser trailer for Pixar's Inside Out 2.
The clip opens with Riley, the original protagonist of the 2015 film, celebrating her 13th birthday,… [+1687 chars]",entertainment-weekly,Entertainment Weekly
Dalton Ross,'Big Brother' season 25 jury speaks in exclusive finale interview,"The 'Big Brother' season 25 jury speaks in exclusive finale interview with Felicia, Cirie, America, Blue, Cory, and Cameron.",https://ew.com/tv/big-brother-25-jury-speaks-finale-exclusive-interview/,https://ew.com/thmb/Xf862sIucHD7gnmrg3BJbMejhns=/1500x0/filters:no_upscale():max_bytes(150000):strip_icc()/big-brother-jurors-2000-91e893b81ff0424d83dd1c1c8bb8d6f1.jpg,2023-11-09T14:45:00Z,"They had visions of $750,000 dancing in their heads. Those dreams, however, were cruelly dashed one by one as players were evicted from the Big Brother house. But for the six most recent contestants … [+14069 chars]",entertainment-weekly,Entertainment Weekly
Wesley Stenzel,Zac Efron 'hugely honored' that Matthew Perry wanted him for biopic,"Matthew Perry envisioned Zac Efron playing him in a biopic about his life, and the 'Iron Claw' actor says he was 'hugely honored' by the idea. 'I'm still devasted by the fact that he is gone,' Efron said.",https://ew.com/celebrity/zac-efron-matthew-perry-biopic-hugely-honored/,https://ew.com/thmb/5Rj1oXjagli9cRntWOHYZsZ-wdU=/1500x0/filters:no_upscale():max_bytes(150000):strip_icc()/zac-efron-matthew-perry-110823-1-eac5d165b2a8452fa96c8000dfbcc2ac.jpg,2023-11-09T03:23:55Z,"Matthew Perry wanted to reunite with Zac Efron for a movie about his life and now, the Iron Claw star has commented on the late Friends actor's wishes.
""I was hugely honored,"" Efron said of the rece… [+2138 chars]",entertainment-weekly,Entertainment Weekly
Maureen Lee Lenker,The SAG-AFTRA strike is finally over after 118 days,SAG-AFTRA has reached a tentative deal with the AMPTP to end the actors strike after 118 days on the picket line.,https://ew.com/tv/sag-aftra-reaches-tentative-deal-end-strike/,https://ew.com/thmb/aQlkKczHAHm-LREeLcL009-08M4=/1500x0/filters:no_upscale():max_bytes(150000):strip_icc()/sag-strike-nyc-traks-pm-072523-da292e92c87e4a7dada92ecfd71e680c-06c372ed69bd4937bd76b4a1640c1375.jpg,2023-11-09T01:08:08Z,"At long last, actors will be putting down their picket signs and picking up their scripts once again.
On Wednesday, the Screen Actors Guild-American Federation of Television and Radio Artists (SAG-A… [+5529 chars]",entertainment-weekly,Entertainment Weekly
Dustin Nelson,"Teenage Mutant Ninja Turtles get commemorative manhole cover in Dover, N.H.",The Teenage Mutant Ninja Turtles just got a commemorative manhole cover outside the building where Kevin Eastman and Peter Laird created the legendary crime fighters 40 years ago.,https://ew.com/books/teenage-mutant-ninja-turtles-commemorative-manhole-sewer-dover/,https://ew.com/thmb/l4y4KOO05yiSfxLsHSPLPBgrNb8=/1500x0/filters:no_upscale():max_bytes(150000):strip_icc()/Teenage-Mutant-Ninja-Turtles-110723-2-3bcf46a5530f42ffbc4ab5892eb6fd10.jpg,2023-11-09T00:23:35Z,"The Teenage Mutant Ninja Turtles may evoke the stylized and smoky, rain-splattered streets of New York (or maybe just sewers in general), but Dover, N.H., doesn't want to be forgotten in the conversa… [+2908 chars]",entertainment-weekly,Entertainment Weekly
Jessica Wang,Shania Twain's tour crew injured in rollover bus crash in Canada,Members of Shania Twain's tour crew were injured in a rollover bus crash in Canada. The singer was not on board at the time of accident.,https://ew.com/music/shania-twain-tour-crew-injured-bus-crash-canada/,https://ew.com/thmb/N7OuyIxqdEU1031LUT9Cu3OPL-E=/1500x0/filters:no_upscale():max_bytes(150000):strip_icc()/Shania-Twain-070223-a279f65205464194979cc26516f8ab44.jpg,2023-11-08T22:56:12Z,"Members of Shania Twain's production crew were injured in a rollover bus crash near Wolseley, Saskatchewan, in Canada on Wednesday morning.
Maverick Management, which represents the Canadian singer-… [+1247 chars]",entertainment-weekly,Entertainment Weekly
Joey Nolfi,Kristin Chenoweth responds to 'Bachelor' star's Lady Gaga shade,Kristin Chenoweth said she's 'ready to sing' with Lady Gaga after 'Bachelor' star Carly Waddell shaded former classmate Gaga for belting 'Wicked' tunes at NYU.,https://ew.com/music/kristin-chenoweth-lady-gaga-wicked-song-bachelor-star-shade/,https://ew.com/thmb/oPm9c1sNXqgk9mgtRrPS_YBYhNA=/1500x0/filters:no_upscale():max_bytes(150000):strip_icc()/Lady-Gaga-Kristin-Chenoweth-110823-cc8789adacf44388821c45e5625f01a4.jpg,2023-11-08T21:55:41Z,"Contrary to the beliefs of that legendary anti-Stefani Germanotta Facebook group, Lady Gaga, you will always be famous to Kristin Chenoweth.
Gaga's former NYU classmate, ex-Bachelor star Carly Wadde… [+1983 chars]",entertainment-weekly,Entertainment Weekly
Dustin Nelson,Tony Shalhoub is back as Monk in 'Mr. Monk's Last Case' trailer,Tony Shalhoub returns as the OCD-afflicted private detective Adrian Monk in the new trailer for 'Mr. Monk's Last Case' — and he's packing plenty of hand sanitizer.,https://ew.com/movies/mr-monks-last-case-trailer-tony-shalhoub/,https://ew.com/thmb/jqHHaDWzL6EwXflNPk99JjnBd2c=/1500x0/filters:no_upscale():max_bytes(150000):strip_icc()/Monk-movie-110823-3d94a20d10a94687b9dc7c481fd78ad3.jpg,2023-11-08T20:41:34Z,"Tony Shalhoub's Adrian Monk is back, hand sanitizer in hand, taking a case for the first time since Monk concluded its 125-episode run in 2009. The private detective battling severe OCD and a range o… [+2878 chars]",entertainment-weekly,Entertainment Weekly
Joey Nolfi,'The View' star Whoopi Goldberg scolds millennials who don't work,"'The View' star Whoopi Goldberg scolded millennials who don't want to work: 'If you only want to work four hours, it's going to be harder for you to get a house.'",https://ew.com/tv/whoopi-goldberg-scolds-millennials-who-dont-want-to-work/,https://ew.com/thmb/OD8nxk6-zKIYOsxJ_4SAx2mdgC0=/1500x0/filters:no_upscale():max_bytes(150000):strip_icc()/The-View-110823-c58dcff2ed854a9786f434da7e7eadb5.jpg,2023-11-08T17:33:26Z,"Whoopi Goldberg, who famously doesn't want somebody in her house, still has opinions on millennials who don't want to work hard for a humble abode of their own.
During a Wednesday Hot Topics discuss… [+1793 chars]",entertainment-weekly,Entertainment Weekly
Clark Collis,"'Ghostbusters: Frozen Empire' trailer with Finn Wolfhard, Paul Rudd released","Everybody, freeze! The new 'Ghostbusters' movie is now titled 'Frozen Empire,' and the first trailer has turned NYC into an icy tundra.",https://ew.com/movies/ghostbusters-frozen-empire-trailer-finn-wolfhard-paul-rudd/,https://ew.com/thmb/oEHkEddEGqni9ma6CcfM6VAuuCA=/1500x0/filters:no_upscale():max_bytes(150000):strip_icc()/ghostbusters-frozen-empire-110823-1-0541b96cf15542929f629a8b5b4629e2.jpg,2023-11-08T16:03:34Z,"Everybody freeze!
The first trailer just arrived for the new Ghostbusters movie now officially titled Ghostbusters: Frozen Empire and you will not be in criminal violation of the Environmental Prote… [+2400 chars]",entertainment-weekly,Entertainment Weekly
Jessica Wang,'Mean Girls' movie musical trailer brings back the Plastics,"The first-look trailer at the 'Mean Girls' movie musical sees the likes of Regina George, Cady Heron, Janis Ian, and more — now with more music.",https://ew.com/movies/mean-girls-movie-musical-trailer/,https://ew.com/thmb/JSQaep_QlCYjns-JWDj27qidFKA=/1500x0/filters:no_upscale():max_bytes(150000):strip_icc()/mean-girls-110823-1-2000-f3289edaaaaa4a28a70a46569218467b.jpg,2023-11-08T14:00:35Z,"Grab some Toaster Strudels because Paramount released the first trailer for the Mean Girls movie musical.
A new era of Plastics terrorizes new girl Cady Heron (Angourie Rice) and the rest of North S… [+3261 chars]",entertainment-weekly,Entertainment Weekly
Samantha Highfill,Patrick Dempsey is PEOPLE's Sexiest Man Alive 2023,"What a McDream! Patrick Dempsey is PEOPLE's 2023 Sexiest Man Alive, joining the ranks of past titleholders Chris Evans, Paul Rudd, Michael B. Jordan, and more.",https://ew.com/celebrity/patrick-dempsey-people-sexiest-man-alive-2023/,https://ew.com/thmb/tkrfW0tSCiDXvappbrhjvfj4ENw=/1500x0/filters:no_upscale():max_bytes(150000):strip_icc()/Patrick-Dempsey-110723-1-09de787c1b40460ba7b4250b4ec320c8.jpg,2023-11-08T04:53:10Z,"There's sexy ... and then there's dreamy.
PEOPLE has chosen, and this year's Sexiest Man Alive is none other than McDreamy himself, Patrick Dempsey (finally!)
Dempsey, who's best known for playing … [+1456 chars]",entertainment-weekly,Entertainment Weekly
Sydney Bucksbaum,'The White Lotus' creator teases 'supersized' season 3,"'The White Lotus' creator Mike White teases 'supersized' season 3: 'It's going to be longer, bigger, crazier.'",https://ew.com/tv/the-white-lotus-creator-mike-white-teases-supersized-season-3/,https://ew.com/thmb/l2_B2ZW_6uY16ftONzys2HJs6Hs=/1500x0/filters:no_upscale():max_bytes(150000):strip_icc()/The-White-Lotus-Cast-season-2-HBO-16edefafbc384ab599929c7da39118ab.jpg,2023-11-08T00:43:26Z,"Get your passports ready, because it's almost time to head back to The White Lotus.
Creator Mike White tells EW that he hopes to start filming season 3 of HBO's vacation drama ""at the beginning of t… [+1738 chars]",entertainment-weekly,Entertainment Weekly
Wesley Stenzel,Lady Gaga annoyed 'Bachelor' alum Carly Waddell in college,Carly Waddell of 'The Bachelor' fame was constantly irritated by Lady Gaga when they went to college together: 'She would play on the piano… and we were all just trying to eat lunch.',https://ew.com/celebrity/lady-gaga-annoyed-bachelor-alum-carly-waddell-in-college/,https://ew.com/thmb/EEvmwedODuekua0vdqJSFhSNQTk=/1500x0/filters:no_upscale():max_bytes(150000):strip_icc()/Carly-Waddell-lady-gaga-110723-e0f2dddeddba49a29a7b7fba07336d57.jpg,2023-11-08T00:41:14Z,"Before Lady Gaga was on the edge of glory, she was a student at NYU's Tisch School of the Arts and one classmate, The Bachelor alum Carly Waddell, wasn't a fan.
During a recent appearance on Jason T… [+2316 chars]",entertainment-weekly,Entertainment Weekly
Devan Coggan,Nintendo is making a live-action 'Legend of Zelda' movie,"Hyrule is going Hollywood: Nintendo is developing a live-action 'Legend of Zelda' movie, with 'Maze Runner' filmmaker Wes Ball set to direct.",https://ew.com/movies/nintendo-making-live-action-legend-of-zelda-movie/,https://ew.com/thmb/w6cMMT71nQjyP8INOVk_pHCyuaI=/1500x0/filters:no_upscale():max_bytes(150000):strip_icc()/legend-of-zelda-breath-of-the-wild-sequel-2000-7bb2ae9304cb4ba489d9e9b71dd6cac9.jpg,2023-11-07T23:43:48Z,"Hyrule is going Hollywood.
Nintendo announced Tuesday that it's developing a live-action Legend of Zelda film, centering on everyone's favorite sword-wielding blond hero from the iconic video game f… [+1628 chars]",entertainment-weekly,Entertainment Weekly
Clark Collis,'The Crown' insider says making final season was 'very odd','The Crown' insider says making the final season was a 'very odd' experience.,https://ew.com/tv/the-crown-insider-final-season-odd-experience/,https://ew.com/thmb/huFRfM0_x_1D0xoXzAnBYfJIsRE=/1500x0/filters:no_upscale():max_bytes(150000):strip_icc()/The-Crown-Season-6-101623-04-98286e183582459cb21114bf1a061b72.jpg,2023-11-07T23:00:00Z,"The Crown costume designer Amy Roberts tells EW that there was an ""oddness"" about the shoot for the Netflix drama's final season and, frankly, it would be a right royal surprise if that wasn't the ca… [+4234 chars]",entertainment-weekly,Entertainment Weekly
Emlyn Travis,Jeremy Allen White recalls failed meeting for a 'Marvel-y movie',Jeremy Allen White says he lost out on a 'Marvel-y movie' because he had an 'attitude' during the meeting: 'I played it the way I wanted to play it.',https://ew.com/movies/jeremy-allen-white-recalls-failed-audition-for-marvel-y-movie/,https://ew.com/thmb/p-m02SHX3OzUAc3PKFYLgt3yifY=/1500x0/filters:no_upscale():max_bytes(150000):strip_icc()/Jeremy-Allen-White-110723-dff4d7d4df744674814f5c6039891571.jpg,2023-11-07T19:27:32Z,"Jeremy Allen White isn't interested in becoming the next big superhero.
The Bear actor revealed in a recent British GQ interview that he once ""had a meeting for a kind of Marvel-y movie"" but it quic… [+1902 chars]",entertainment-weekly,Entertainment Weekly
Wesley Stenzel,We may never know if Drew Barrymore accepted Pauly Shore's proposal,"Drew Barrymore left Pauly Shore hanging after he proposed to her on Friday's episode of her daytime talk show. Now, it seems that we'll never know her answer.",https://ew.com/tv/never-know-drew-barrymore-accepted-pauly-shore-marriage-proposal/,https://ew.com/thmb/V_lKyuADi3MwNo5h54bn0qBTzWI=/1500x0/filters:no_upscale():max_bytes(150000):strip_icc()/drew-barrymore-pauly-shore-110623-c47f3be599a0420d93f219d2b3ae819f.jpg,2023-11-07T00:02:27Z,"Audiences were left holding their breath at the end of Friday's episode of The Drew Barrymore Show, in which Pauly Shoreasked the host to marry him. Now, it seems that fans will never learn her answe… [+1958 chars]",entertainment-weekly,Entertainment Weekly
Wesley Stenzel,Jason Segel revives 'Forgetting Sarah Marshall' Dracula puppet musical,"Watch Jason Segel perform 'Dracula's Lament,' from his vampire puppet musical featured in 'Forgetting Sarah Marshall' more than a decade ago.",https://ew.com/movies/jason-segel-revives-dracula-puppet-musical-from-forgetting-sarah-marshall/,https://ew.com/thmb/0HXRsrlHWlBQz82ezXuv7rwZ90M=/1500x0/filters:no_upscale():max_bytes(150000):strip_icc()/Jason-Segel-Dracula11062311-26bc5824483748b49367ca4052726d6a.jpg,2023-11-06T23:02:22Z,"Jason Segel played Marshall on How I Met Your Mother for nine years, but a different role has officially become his longest-running character: puppet Dracula.
The actor and longtime Muppet enthusias… [+3375 chars]",entertainment-weekly,Entertainment Weekly
Shania Russell,Jesse Tyler Ferguson reunites with 'Modern Family' daughter,Jesse Tyler Ferguson attended 'Modern Family' daughter Aubrey Anderson-Emmons' school play: 'You make a pretend papa proud.',https://ew.com/tv/jesse-tyler-ferguson-reunites-with-modern-family-daughter/,https://ew.com/thmb/Nk7NBn_8DE_76AWjHQiXExBFDhY=/1500x0/filters:no_upscale():max_bytes(150000):strip_icc()/jesse-tyler-ferguson-Aubrey-Anderson-Emmons-1-110623-c381e00f71734984af81fb42d77f3726.jpg,2023-11-06T20:44:46Z,"The Tucker-Pritchett family is (almost) back together.
Even when the cameras are off, Jesse Tyler Ferguson is a supportive dad to his TV daughter, Aubrey Anderson-Emmons. The Modern Family alums who… [+2185 chars]",entertainment-weekly,Entertainment Weekly
Jessica Wang,Rachel Zegler channels Katniss at 'Hunger Games' prequel premiere,Rachel Zegler channeled Jennifer Lawrence's Katniss Everdeen at the premiere of 'Hunger Games' prequel 'Ballad of Songbirds and Snakes.',https://ew.com/movies/rachel-zegler-channels-katniss-everdeen-hunger-games-ballad-of-songbirds-and-snakes-premiere/,https://ew.com/thmb/4oZ2-qk1xKe90dHU9mzlu5KxvU0=/1500x0/filters:no_upscale():max_bytes(150000):strip_icc()/rachel-zegler-jennifer-lawrence-catching-fire-dress-110623-6f4cc93565694b9ba7f5636ccef1a7dd.jpg,2023-11-06T19:31:25Z,"Cinna would be so proud.
Rachel Zegler paid homage to a major Hunger Games fashion moment at the Berlin premiere of prequel movie Ballad of Songbirds and Snakes. At Zoo Palast on Sunday, Zegler chan… [+1788 chars]",entertainment-weekly,Entertainment Weekly
Shania Russell,Matthew Perry stopped Chandler cheating storyline on 'Friends','Friends' guest star Lisa Cash says the late Matthew Perry convinced the show's writers to scrap a storyline about Chandler cheating on Monica.,https://ew.com/tv/friends-matthew-perry-stopped-chandler-cheating-storyline/,https://ew.com/thmb/grkT1JQoNc8i1Iw1dIjcNKZNu7M=/1500x0/filters:no_upscale():max_bytes(150000):strip_icc()/matthew-perry-courtney-cox-the-one-in-vegas-110623-a688174120444f2e9a7b138ef8670b57.jpg,2023-11-06T19:21:42Z,"Friends star Matthew Perry apparently saved Chandler and Monica from a cheating scandal that would've rivaled Ross and Rachel's.
In the wake of Perry's unexpected death at 54, one-time Friends guest… [+3532 chars]",entertainment-weekly,Entertainment Weekly
Clark Collis,Read Stephen King's 'Cujo' sequel in excerpt from new story collection,"Stephen King returns to the world of 'Cujo' in short story collection, 'You Like It Darker.' Read an exclusive excerpt.",https://ew.com/books/stephen-king-cujo-sequel-you-like-it-darker/,https://ew.com/thmb/FSBtwx2642fd_WkAWjEEjgNxmj4=/1500x0/filters:no_upscale():max_bytes(150000):strip_icc()/You-Like-it-Darker-by-Stephen-King-110223-1-26bd53ec5ca04140955632457a73dbb1.jpg,2023-11-06T18:00:00Z,"Are you rabid for more Stephen King? Then fear not or maybe fear plenty.
The author's new collection of short stories, You Like It Darker, will be published by Scribner on May 21, 2024. The book fea… [+4646 chars]",entertainment-weekly,Entertainment Weekly
Devan Coggan,"Zac Efron, Jeremy Allen White on true story of 'Iron Claw'","Zac Efron, Jeremy Allen White, and Harris Dickinson open up about 'The Iron Claw,' A24's highly anticipated wrestling drama about the legendary Von Erich family.",https://ew.com/movies/iron-claw-true-story-zac-efron-jeremy-allen-white-harris-dickinson-cover-story/,https://ew.com/thmb/zJbty3NT2gLly__XJEYZKF3vnoM=/1500x0/filters:no_upscale():max_bytes(150000):strip_icc()/THE-IRON-CLAW-110323-22-1f5bf114b8d142b1a47270b301fde13d.jpg,2023-11-06T17:21:07Z,"The stars of The Iron Clawmay not be blood relatives, but spending an afternoon with them feels a lot like hanging out with three actual brothers. In between takes at their EW cover shoot in late Oct… [+16028 chars]",entertainment-weekly,Entertainment Weekly
Shania Russell,Black Panther stuntman and children killed in car crash,"Taraja Ramsess, a stuntman whose work appears in 'Black Panther,' 'Avengers: Endgame,' and more, was killed in car crash along with three of his children.",https://ew.com/movies/black-panther-stuntman-taraja-ramsess-fatal-car-crash/,https://ew.com/thmb/LcAMtgViNOO7KPnqooavXOLrYUU=/1500x0/filters:no_upscale():max_bytes(150000):strip_icc()/taraja-ramsess-black-panther-stuntman-dead-110623-fce28aa36e8a4bc9a01618b9208eeb84.jpg,2023-11-06T16:11:26Z,"Taraja Ramsess, a stuntman and actor who worked on both Black Panther films, died in a fatal Atlanta car crash along with three of his children. He was 41.
Local news outlet Fox-Atlanta confirmed th… [+2426 chars]",entertainment-weekly,Entertainment Weekly
Shania Russell,Peter White dead: All My Children star was 86,"Peter White, who portrayed Linc Tyler in 'All My Children' and originated the role of Alan McCarthy in 'The Boys in the Band,' has died. He was 86.",https://ew.com/celebrity/peter-white-dead-all-my-children-the-boys-in-the-band-actor-86/,https://ew.com/thmb/M4GXm54qjKAmEJBRaPAwDpsSKss=/1500x0/filters:no_upscale():max_bytes(150000):strip_icc()/Peter-White-110523-2-8c0cf6efadaf44cc89cda88705a6dfc4.jpg,2023-11-05T20:38:04Z,"Peter White, the actor best known for his groundbreaking role in The Boys in the Band, and a recurring stint in All My Children, has died. He was 86.
White died Wednesday in his Los Angeles home aft… [+2759 chars]",entertainment-weekly,Entertainment Weekly
